{
 "$schema": "https://json-schema.org/draft/2020-12/schema",
 "$id": "https://blockchains.github.io/blockchainlab-api/v1/schemas/chains-tvl.schema.json",
 "title": "chains-tvl",
 "description": "DeFi TVL by chain (USD). Snapshot from DefiLlama.",
 "x-schema-version": "1.1.0",
 "type": "object",
 "required": [
  "dataset",
  "generated_at",
  "source",
  "source_url",
  "data"
 ],
 "properties": {
  "dataset": {
   "type": [
    "null",
    "string"
   ]
  },
  "api_version": {
   "type": [
    "null",
    "string"
   ]
  },
  "schema_version": {
   "type": [
    "null",
    "string"
   ]
  },
  "schema_url": {
   "type": [
    "string",
    "integer",
    "null"
   ]
  },
  "description": {
   "type": [
    "null",
    "string"
   ]
  },
  "generated_at": {
   "type": [
    "string",
    "integer",
    "null"
   ]
  },
  "source": {
   "type": [
    "null",
    "string"
   ]
  },
  "source_url": {
   "type": [
    "null",
    "string"
   ]
  },
  "built_by": {
   "type": [
    "null",
    "string"
   ]
  },
  "licence_note": {
   "type": [
    "null",
    "string"
   ]
  },
  "count": {
   "type": [
    "string",
    "integer",
    "null"
   ]
  },
  "data": {
   "type": "array",
   "items": {
    "type": "object",
    "properties": {
     "rank": {
      "type": [
       "null",
       "number"
      ]
     },
     "name": {
      "type": [
       "null",
       "string"
      ]
     },
     "chainId": {
      "type": [
       "null",
       "number",
       "string"
      ]
     },
     "token": {
      "type": [
       "null",
       "string"
      ]
     },
     "tvl_usd": {
      "type": [
       "null",
       "number"
      ]
     },
     "defillama_url": {
      "type": [
       "null",
       "string"
      ]
     }
    },
    "required": [
     "chainId",
     "defillama_url",
     "name",
     "rank",
     "token",
     "tvl_usd"
    ]
   }
  }
 }
}