{"dataset":"chains-tvl","api_version":"v1","schema_version":"1.1.0","schema_url":"https://blockchains.github.io/blockchainlab-api/v1/schemas/chains-tvl.schema.json","description":"DeFi TVL by chain (USD). Snapshot from DefiLlama.","generated_at":"2026-10-20T08:35:26.250Z","source":"DefiLlama","source_url":"https://api.llama.fi/v2/chains","built_by":"Blockchain Lab — https://blockchainlab.com","licence_note":"Data belongs to the named source; check its terms before reuse. Attribute the source and Blockchain Lab.","count":295,"data":[{"rank":1,"name":"Ethereum","chainId":1,"token":"ETH","tvl_usd":49509182366,"defillama_url":"https://defillama.com/chain/Ethereum"},{"rank":2,"name":"Base","chainId":8453,"token":null,"tvl_usd":6165269806,"defillama_url":"https://defillama.com/chain/Base"},{"rank":3,"name":"BSC","chainId":56,"token":"BNB","tvl_usd":5927355858,"defillama_url":"https://defillama.com/chain/BSC"},{"rank":4,"name":"Solana","chainId":null,"token":"SOL","tvl_usd":5903021157,"defillama_url":"https://defillama.com/chain/Solana"},{"rank":5,"name":"Tron","chainId":null,"token":"TRX","tvl_usd":5520762817,"defillama_url":"https://defillama.com/chain/Tron"},{"rank":6,"name":"Bitcoin","chainId":null,"token":"BTC","tvl_usd":4375428043,"defillama_url":"https://defillama.com/chain/Bitcoin"},{"rank":7,"name":"Arbitrum","chainId":42161,"token":"ARB","tvl_usd":1409315928,"defillama_url":"https://defillama.com/chain/Arbitrum"},{"rank":8,"name":"Robinhood Chain","chainId":4663,"token":null,"tvl_usd":1138023850,"defillama_url":"https://defillama.com/chain/Robinhood%20Chain"},{"rank":9,"name":"Hyperliquid L1","chainId":null,"token":"HYPE","tvl_usd":1015385769,"defillama_url":"https://defillama.com/chain/Hyperliquid%20L1"},{"rank":10,"name":"Monad","chainId":143,"token":"MON","tvl_usd":1008796942,"defillama_url":"https://defillama.com/chain/Monad"},{"rank":11,"name":"Polygon","chainId":137,"token":"POL","tvl_usd":675861017,"defillama_url":"https://defillama.com/chain/Polygon"},{"rank":12,"name":"Avalanche","chainId":43114,"token":"AVAX","tvl_usd":586604813,"defillama_url":"https://defillama.com/chain/Avalanche"},{"rank":13,"name":"Plasma","chainId":9745,"token":"XPL","tvl_usd":568989673,"defillama_url":"https://defillama.com/chain/Plasma"},{"rank":14,"name":"Arc","chainId":5042,"token":null,"tvl_usd":525724679,"defillama_url":"https://defillama.com/chain/Arc"},{"rank":15,"name":"Sui","chainId":null,"token":"SUI","tvl_usd":484741052,"defillama_url":"https://defillama.com/chain/Sui"},{"rank":16,"name":"OP Mainnet","chainId":10,"token":"OP","tvl_usd":441556216,"defillama_url":"https://defillama.com/chain/OP%20Mainnet"},{"rank":17,"name":"Anubis","chainId":null,"token":null,"tvl_usd":336884803,"defillama_url":"https://defillama.com/chain/Anubis"},{"rank":18,"name":"Stellar","chainId":null,"token":"XLM","tvl_usd":238079679,"defillama_url":"https://defillama.com/chain/Stellar"},{"rank":19,"name":"Near","chainId":null,"token":"NEAR","tvl_usd":219690587,"defillama_url":"https://defillama.com/chain/Near"},{"rank":20,"name":"Ink","chainId":57073,"token":null,"tvl_usd":201337137,"defillama_url":"https://defillama.com/chain/Ink"},{"rank":21,"name":"Flare","chainId":null,"token":"FLR","tvl_usd":181323449,"defillama_url":"https://defillama.com/chain/Flare"},{"rank":22,"name":"Starknet","chainId":null,"token":"STRK","tvl_usd":158077330,"defillama_url":"https://defillama.com/chain/Starknet"},{"rank":23,"name":"X Layer","chainId":null,"token":null,"tvl_usd":157500505,"defillama_url":"https://defillama.com/chain/X%20Layer"},{"rank":24,"name":"Cronos","chainId":25,"token":"CRO","tvl_usd":137566609,"defillama_url":"https://defillama.com/chain/Cronos"},{"rank":25,"name":"Provenance","chainId":null,"token":"HASH","tvl_usd":118889793,"defillama_url":"https://defillama.com/chain/Provenance"},{"rank":26,"name":"Tempo","chainId":4217,"token":null,"tvl_usd":106979695,"defillama_url":"https://defillama.com/chain/Tempo"},{"rank":27,"name":"Mantle","chainId":5000,"token":"MNT","tvl_usd":102519799,"defillama_url":"https://defillama.com/chain/Mantle"},{"rank":28,"name":"Gnosis","chainId":100,"token":"GNO","tvl_usd":92880994,"defillama_url":"https://defillama.com/chain/Gnosis"},{"rank":29,"name":"Rootstock","chainId":30,"token":"RIF","tvl_usd":78612545,"defillama_url":"https://defillama.com/chain/Rootstock"},{"rank":30,"name":"Mezo","chainId":31612,"token":"MEZO","tvl_usd":78218571,"defillama_url":"https://defillama.com/chain/Mezo"},{"rank":31,"name":"Stacks","chainId":null,"token":"STX","tvl_usd":77188252,"defillama_url":"https://defillama.com/chain/Stacks"},{"rank":32,"name":"Mixin","chainId":null,"token":"XIN","tvl_usd":76280039,"defillama_url":"https://defillama.com/chain/Mixin"},{"rank":33,"name":"Morph","chainId":null,"token":"-","tvl_usd":74520277,"defillama_url":"https://defillama.com/chain/Morph"},{"rank":34,"name":"Pharos","chainId":1672,"token":"PROS","tvl_usd":71716664,"defillama_url":"https://defillama.com/chain/Pharos"},{"rank":35,"name":"dYdX","chainId":null,"token":"dYdX","tvl_usd":70530178,"defillama_url":"https://defillama.com/chain/dYdX"},{"rank":36,"name":"Cardano","chainId":null,"token":"ADA","tvl_usd":61833269,"defillama_url":"https://defillama.com/chain/Cardano"},{"rank":37,"name":"Hydration","chainId":null,"token":"HDX","tvl_usd":53950967,"defillama_url":"https://defillama.com/chain/Hydration"},{"rank":38,"name":"TON","chainId":null,"token":"GRAM","tvl_usd":48757895,"defillama_url":"https://defillama.com/chain/TON"},{"rank":39,"name":"XPR Network","chainId":null,"token":"XPR","tvl_usd":47531529,"defillama_url":"https://defillama.com/chain/XPR%20Network"},{"rank":40,"name":"Vaulta","chainId":null,"token":"A","tvl_usd":45391630,"defillama_url":"https://defillama.com/chain/Vaulta"},{"rank":41,"name":"Aptos","chainId":null,"token":"APT","tvl_usd":43397336,"defillama_url":"https://defillama.com/chain/Aptos"},{"rank":42,"name":"World Chain","chainId":480,"token":"WLD","tvl_usd":43211275,"defillama_url":"https://defillama.com/chain/World%20Chain"},{"rank":43,"name":"PulseChain","chainId":null,"token":"PLS","tvl_usd":42002699,"defillama_url":"https://defillama.com/chain/PulseChain"},{"rank":44,"name":"XRPL","chainId":null,"token":"XRP","tvl_usd":39043784,"defillama_url":"https://defillama.com/chain/XRPL"},{"rank":45,"name":"Katana","chainId":747474,"token":"KAT","tvl_usd":37239786,"defillama_url":"https://defillama.com/chain/Katana"},{"rank":46,"name":"THORChain","chainId":null,"token":"RUNE","tvl_usd":34920468,"defillama_url":"https://defillama.com/chain/THORChain"},{"rank":47,"name":"Algorand","chainId":null,"token":"ALGO","tvl_usd":33994230,"defillama_url":"https://defillama.com/chain/Algorand"},{"rank":48,"name":"Hedera","chainId":295,"token":"HBAR","tvl_usd":33400024,"defillama_url":"https://defillama.com/chain/Hedera"},{"rank":49,"name":"RISE","chainId":null,"token":"RISE","tvl_usd":32888334,"defillama_url":"https://defillama.com/chain/RISE"},{"rank":50,"name":"BOT Chain","chainId":677,"token":"BOT","tvl_usd":32068107,"defillama_url":"https://defillama.com/chain/BOT%20Chain"},{"rank":51,"name":"Berachain","chainId":80094,"token":"BERA","tvl_usd":31814608,"defillama_url":"https://defillama.com/chain/Berachain"},{"rank":52,"name":"Sei","chainId":null,"token":"SEI","tvl_usd":31706951,"defillama_url":"https://defillama.com/chain/Sei"},{"rank":53,"name":"Stable","chainId":988,"token":"STABLE","tvl_usd":29102557,"defillama_url":"https://defillama.com/chain/Stable"},{"rank":54,"name":"Unichain","chainId":130,"token":"-","tvl_usd":26180937,"defillama_url":"https://defillama.com/chain/Unichain"},{"rank":55,"name":"Linea","chainId":59144,"token":"LINEA","tvl_usd":23691027,"defillama_url":"https://defillama.com/chain/Linea"},{"rank":56,"name":"Kava","chainId":null,"token":"KAVA","tvl_usd":20886473,"defillama_url":"https://defillama.com/chain/Kava"},{"rank":57,"name":"Tezos","chainId":null,"token":"XTZ","tvl_usd":19928146,"defillama_url":"https://defillama.com/chain/Tezos"},{"rank":58,"name":"Sonic","chainId":146,"token":"S","tvl_usd":19288819,"defillama_url":"https://defillama.com/chain/Sonic"},{"rank":59,"name":"Fraxtal","chainId":252,"token":"FRAX","tvl_usd":18711699,"defillama_url":"https://defillama.com/chain/Fraxtal"},{"rank":60,"name":"Chainflip","chainId":null,"token":"FLIP","tvl_usd":16346631,"defillama_url":"https://defillama.com/chain/Chainflip"},{"rank":61,"name":"Etherlink","chainId":42793,"token":null,"tvl_usd":15917415,"defillama_url":"https://defillama.com/chain/Etherlink"},{"rank":62,"name":"Strato Chain","chainId":null,"token":null,"tvl_usd":15689759,"defillama_url":"https://defillama.com/chain/Strato%20Chain"},{"rank":63,"name":"ZKsync Era","chainId":324,"token":"ZK","tvl_usd":14508104,"defillama_url":"https://defillama.com/chain/ZKsync%20Era"},{"rank":64,"name":"Injective","chainId":null,"token":"INJ","tvl_usd":14231979,"defillama_url":"https://defillama.com/chain/Injective"},{"rank":65,"name":"Bifrost Network","chainId":null,"token":"BFC","tvl_usd":13643036,"defillama_url":"https://defillama.com/chain/Bifrost%20Network"},{"rank":66,"name":"Celo","chainId":42220,"token":"CELO","tvl_usd":13178167,"defillama_url":"https://defillama.com/chain/Celo"},{"rank":67,"name":"MultiversX","chainId":null,"token":"EGLD","tvl_usd":12593141,"defillama_url":"https://defillama.com/chain/MultiversX"},{"rank":68,"name":"MegaETH","chainId":4326,"token":"MEGA","tvl_usd":12397356,"defillama_url":"https://defillama.com/chain/MegaETH"},{"rank":69,"name":"Canton","chainId":null,"token":"CC","tvl_usd":12218025,"defillama_url":"https://defillama.com/chain/Canton"},{"rank":70,"name":"Osmosis","chainId":null,"token":"OSMO","tvl_usd":11786629,"defillama_url":"https://defillama.com/chain/Osmosis"},{"rank":71,"name":"Immutable zkEVM","chainId":13371,"token":"IMX","tvl_usd":11130442,"defillama_url":"https://defillama.com/chain/Immutable%20zkEVM"},{"rank":72,"name":"Ronin","chainId":2020,"token":"RON","tvl_usd":10833784,"defillama_url":"https://defillama.com/ch